{
  "schema_version": "1.0",
  "source_sha256": "32df5e2843de7e8ccd52d56b9dfed257c26786ef3b71fbc397a1c3a5e26fb0fa",
  "pdf": "/Users/shentianshuo/.agents/skills/evidentia/evals/reader_v3/fresh_ringmoclaw_run/source/paper.pdf",
  "pages": 20,
  "items": [
    {
      "id": "F01",
      "paper_label": "Fig. 1",
      "kind": "figure",
      "page": 2,
      "caption_original": "Fig. 1: Comparison of existing remote sensing research agents and RingMoClaw. RingMoClaw introduces a unified research loop with independent critique and dual-stream experience evolution for continuous model improvement.",
      "caption_status": "OK",
      "source_location": "p.2",
      "role": "critical",
      "depth": "deep",
      "file": "assets/figures/fig01_p2_3988x2475.png",
      "bbox": [
        48.9640007019043,
        355.0955810546875,
        563.0355834960938,
        372.0326843261719
      ],
      "caption_bbox": [
        48.9640007019043,
        355.0955810546875,
        563.0355834960938,
        372.0326843261719
      ],
      "figure_bbox": [
        74.66899871826172,
        56.068389892578125,
        537.3408203125,
        343.2080078125
      ],
      "subfigures": [],
      "asset": "assets/figures/fig01_p2_3988x2475.png",
      "extraction_method": "embedded",
      "confidence": 0.9,
      "inspection": "inspected",
      "inspection_status": "inspected",
      "reviewed_by": null,
      "review_note": null,
      "binding_method": "MULTIMODAL_PAGE_LOCALIZATION",
      "binding_confidence": 0.99,
      "needs_visual_review": false,
      "needs_review": false,
      "row_count": null,
      "col_count": null,
      "structure": null,
      "headers": null,
      "rows": null,
      "parsed_cells": null,
      "raw_visual_fallback": null,
      "structure_status": null,
      "reconstruction_confidence": null,
      "localization_method": "MULTIMODAL_PAGE_LOCALIZATION",
      "localization_confidence": 0.99
    },
    {
      "id": "F02",
      "paper_label": "Fig. 2",
      "kind": "figure",
      "page": 4,
      "caption_original": "Fig. 2: Overall architecture of RingMoClaw. The self-evolving research pipeline (left) and the Critic pipeline (right) are coupled through a dual-stream dynamic experience bus (center), which integrates external knowledge flow and internal experimental flow to support automated research iteration and the continuous refinement of the structured search space.",
      "caption_status": "OK",
      "source_location": "p.4",
      "role": "critical",
      "depth": "deep",
      "file": "assets/figures/fig02_p4_4594x1975.png",
      "bbox": [
        48.9640007019043,
        288.9615783691406,
        563.03564453125,
        314.86468505859375
      ],
      "caption_bbox": [
        48.9640007019043,
        288.9615783691406,
        563.03564453125,
        314.86468505859375
      ],
      "figure_bbox": [
        48.9640007019043,
        56.068328857421875,
        563.03759765625,
        277.072998046875
      ],
      "subfigures": [],
      "asset": "assets/figures/fig02_p4_4594x1975.png",
      "extraction_method": "embedded",
      "confidence": 0.9,
      "inspection": "inspected",
      "inspection_status": "inspected",
      "reviewed_by": null,
      "review_note": null,
      "binding_method": "MULTIMODAL_PAGE_LOCALIZATION",
      "binding_confidence": 0.99,
      "needs_visual_review": false,
      "needs_review": false,
      "row_count": null,
      "col_count": null,
      "structure": null,
      "headers": null,
      "rows": null,
      "parsed_cells": null,
      "raw_visual_fallback": null,
      "structure_status": null,
      "reconstruction_confidence": null,
      "localization_method": "MULTIMODAL_PAGE_LOCALIZATION",
      "localization_confidence": 0.99
    },
    {
      "id": "F03",
      "paper_label": "Fig. 3",
      "kind": "figure",
      "page": 6,
      "caption_original": "Fig. 3: Object-detection workflow of the proposed framework. The research pipeline performs staged model optimization, while the Critic mechanism reviews intermediate outputs and returns feedback for strategy revision and experience accumulation.",
      "caption_status": "OK",
      "source_location": "p.6",
      "role": "critical",
      "depth": "deep",
      "file": "assets/figures/fig03_p6_2481x2264.png",
      "bbox": [
        48.9640007019043,
        302.517578125,
        300.02215576171875,
        337.3866882324219
      ],
      "caption_bbox": [
        48.9640007019043,
        302.517578125,
        300.02215576171875,
        337.3866882324219
      ],
      "figure_bbox": [
        48.9640007019043,
        56.07139587402344,
        306.0046081542969,
        290.6300048828125
      ],
      "subfigures": [],
      "asset": "assets/figures/fig03_p6_2481x2264.png",
      "extraction_method": "embedded",
      "confidence": 0.9,
      "inspection": "inspected",
      "inspection_status": "inspected",
      "reviewed_by": null,
      "review_note": null,
      "binding_method": "MULTIMODAL_PAGE_LOCALIZATION",
      "binding_confidence": 0.99,
      "needs_visual_review": false,
      "needs_review": false,
      "row_count": null,
      "col_count": null,
      "structure": null,
      "headers": null,
      "rows": null,
      "parsed_cells": null,
      "raw_visual_fallback": null,
      "structure_status": null,
      "reconstruction_confidence": null,
      "localization_method": "MULTIMODAL_PAGE_LOCALIZATION",
      "localization_confidence": 0.99
    },
    {
      "id": "F04",
      "paper_label": "Fig. 4",
      "kind": "figure",
      "page": 7,
      "caption_original": "Fig. 4: Illustration of the Critic mechanism. The Critic mechanism intervenes at three key nodes of the execution chain, namely the plan review, the data review, and the result review. All feedback is routed through the Main Agent for global coordination, and every iteration is written into the global experience pool after standardization.",
      "caption_status": "OK",
      "source_location": "p.7",
      "role": "critical",
      "depth": "deep",
      "file": "assets/figures/fig04_p7_1684x1946.png",
      "bbox": [
        48.9640007019043,
        335.2845764160156,
        300.02215576171875,
        379.11968994140625
      ],
      "caption_bbox": [
        48.9640007019043,
        335.2845764160156,
        300.02215576171875,
        379.11968994140625
      ],
      "figure_bbox": [
        58.827999114990234,
        56.07080078125,
        290.161865234375,
        323.39599609375
      ],
      "subfigures": [],
      "asset": "assets/figures/fig04_p7_1684x1946.png",
      "extraction_method": "embedded",
      "confidence": 0.9,
      "inspection": "inspected",
      "inspection_status": "inspected",
      "reviewed_by": null,
      "review_note": null,
      "binding_method": "MULTIMODAL_PAGE_LOCALIZATION",
      "binding_confidence": 0.99,
      "needs_visual_review": false,
      "needs_review": false,
      "row_count": null,
      "col_count": null,
      "structure": null,
      "headers": null,
      "rows": null,
      "parsed_cells": null,
      "raw_visual_fallback": null,
      "structure_status": null,
      "reconstruction_confidence": null,
      "localization_method": "MULTIMODAL_PAGE_LOCALIZATION",
      "localization_confidence": 0.99
    },
    {
      "id": "F05",
      "paper_label": "Fig. 5",
      "kind": "figure",
      "page": 8,
      "caption_original": "Fig. 5: Dual-stream dynamic experience bus for autonomous research evolution. External knowledge from literature and code and internal experience from task memory and cross-task memory are integrated into global and local experience pools. The experience bus dynamically prunes and expands the structured search space, guides candidate scheme instantiation, and updates the main agent through agile verification, thereby transforming blind trial-and-error search into experience-guided optimization toward task-specific solutions.",
      "caption_status": "OK",
      "source_location": "p.8",
      "role": "critical",
      "depth": "deep",
      "file": "assets/figures/fig05_p8_4400x1393.png",
      "bbox": [
        48.9640007019043,
        222.569580078125,
        563.0355224609375,
        257.43865966796875
      ],
      "caption_bbox": [
        48.9640007019043,
        222.569580078125,
        563.0355224609375,
        257.43865966796875
      ],
      "figure_bbox": [
        61.816001892089844,
        56.070159912109375,
        550.1776123046875,
        210.6810302734375
      ],
      "subfigures": [],
      "asset": "assets/figures/fig05_p8_4400x1393.png",
      "extraction_method": "embedded",
      "confidence": 0.9,
      "inspection": "inspected",
      "inspection_status": "inspected",
      "reviewed_by": null,
      "review_note": null,
      "binding_method": "MULTIMODAL_PAGE_LOCALIZATION",
      "binding_confidence": 0.99,
      "needs_visual_review": false,
      "needs_review": false,
      "row_count": null,
      "col_count": null,
      "structure": null,
      "headers": null,
      "rows": null,
      "parsed_cells": null,
      "raw_visual_fallback": null,
      "structure_status": null,
      "reconstruction_confidence": null,
      "localization_method": "MULTIMODAL_PAGE_LOCALIZATION",
      "localization_confidence": 0.99
    },
    {
      "id": "T01",
      "paper_label": "TABLE I",
      "kind": "table",
      "page": 9,
      "caption_original": "TABLE I: OBJECT DETECTION RESULTS ON FAIR1M (%). OVERALL MAP50 AND PER-CATEGORY AP ARE REPORTED FOR SELECTED WEAK CATEGORIES. REPRESENTATIVE DETECTORS ARE COMPARED WITH THE BASELINE AND SUCCESSIVE EVOLUTION STAGES OF RINGMOCLAW. BEST RESULTS ARE IN BOLD.",
      "caption_status": "OK",
      "source_location": "p.9",
      "role": "critical",
      "depth": "deep",
      "file": "assets/figures/crop_T01_p9_923x898.png",
      "bbox": [
        54.013031005859375,
        58.393550872802734,